23806,Sprint,16116,Private Sector,United States,Various Recipients,14744,Individual,Nepal,27/05/2015 00:00,0,Inkind,Disbursement,"Sprint announced that they will waive all fees associated with contacting individuals in Nepal dating back to April 25 until May 16, 2015 in an effort to increase communication to the area - aiding families and friends but also emergency personnel.",Grant,US Chamber of Commerce Foundation,http://www.uschamberfoundation.org/corporate-citizenship-center/nepal-earthquake-corporate-aid-tracker,Shelter and Non-food Items,Not available,,,,,,,,,,,,,,,,,,,,,,,,,,,,,,,
23807,Square Cash,16117,Private Sector,United States,Various Recipients,14744,Individual,Nepal,27/05/2015 00:00,0,Inkind,Disbursement,"Square Cash, the mobile payment company, set up a unique cashtag for users to directly donate funds to UNICEF relief efforts.",Grant,US Chamber of Commerce Foundation,http://www.uschamberfoundation.org/corporate-citizenship-center/nepal-earthquake-corporate-aid-tracker,Shelter and Non-food Items,Not available,,,,,,,,,,,,,,,,,,,,,,,,,,,,,,,
23808,Sears Canada,16111,Private Sector,Canada,Various Recipients,14744,Individual,Nepal,27/05/2015 00:00,0,Inkind,Disbursement,"Sears Canada Inc. is making it easy for Canadians to help the people of Nepal by accepting donations to the Sir Edmund Hillary Foundation of Canada (SEHF) at all Sears retail stores across Canada, and by phone, beginning Wednesday, April 29 through Monday, May 4. Sears Canada is also making a corporate donation based on what its customers and team members donate.",Grant,US Chamber of Commerce Foundation,http://www.uschamberfoundation.org/corporate-citizenship-center/nepal-earthquake-corporate-aid-tracker,Shelter and Non-food Items,Not available,,,,,,,,,,,,,,,,,,,,,,,,,,,,,,,
23816,Time Warner Cable,16130,Private Sector,Nepal,Various Recipients,14744,Individual,Nepal,27/05/2015 00:00,0,Inkind,Disbursement,"Time Warner Cable home phone and business services customers can place calls free of charge to Nepal, India, and China as of April 25th through May 25th.",Grant,US Chamber of Commerce Foundation,http://www.uschamberfoundation.org/corporate-citizenship-center/nepal-earthquake-corporate-aid-tracker,Shelter and Non-food Items,Not available,,,,,,,,,,,,,,,,,,,,,,,,,,,,,,,
23817,T-Mobile,16124,Private Sector,Nepal,Various Recipients,14744,Individual,Nepal,27/05/2015 00:00,0,Inkind,Disbursement,"As of April 26th, T-Mobile announced that all calls and texts to and from Nepal will be waived. The announcement includes T-Mobile, MetroPCS, GoSmart Mobile, and Walmart Family Mobile customers.",Grant,US Chamber of Commerce Foundation,http://www.uschamberfoundation.org/corporate-citizenship-center/nepal-earthquake-corporate-aid-tracker,Shelter and Non-food Items,Not available,,,,,,,,,,,,,,,,,,,,,,,,,,,,,,,
23818,United Nations,16135,Multilateral,Not applicable,Various Recipients,14744,Individual,Nepal,27/05/2015 00:00,147783,Cash,Disbursement,,Grant,Online Khabar,http://www.onlinekhabar.com/2015/04/271697/,Shelter and Non-food Items,Not available,,,,,,,,,,,,,,,,,,,,,,,,,,,,,,,
23819,Vatican City (Government of),16138,Government,Holy See (Vatican City State),Various Recipients,14744,Individual,Nepal,27/05/2015 00:00,100000,Inkind,Disbursement,,Grant,Wikipedia - May 3,http://en.wikipedia.org/wiki/2015_Nepal_earthquake,Not available,Not available,,,,,,,,,,,,,,,,,,,,,,,,,,,,,,,
23823,Verizon,16139,Private Sector,Nepal,Various Recipients,14744,Individual,Nepal,27/05/2015 00:00,0,Inkind,Disbursement,"In addition to waiving long-distance calls and texts from April 25 through May 31, Verizon is also matching employees donations of up to $1000 per employee. Verizon Wireless also support test-to-donate programs.",Grant,US Chamber of Commerce Foundation,http://www.uschamberfoundation.org/corporate-citizenship-center/nepal-earthquake-corporate-aid-tracker,Shelter and Non-food Items,Not available,,,,,,,,,,,,,,,,,,,,,,,,,,,,,,,
23824,Viber,16140,Private Sector,Nepal,Various Recipients,14744,Individual,Nepal,27/05/2015 00:00,0,Inkind,Disbursement,Viber has temporarily switched off billing in Nepal through Viber Out so that local users can make free calls to mobile and land lines. The instant messaging and internet calling company's feature allows for any user with an internet connection to contact family and friends anywhere in the world.,Grant,US Chamber of Commerce Foundation,http://www.uschamberfoundation.org/corporate-citizenship-center/nepal-earthquake-corporate-aid-tracker,Shelter and Non-food Items,Not available,,,,,,,,,,,,,,,,,,,,,,,,,,,,,,,
23825,Vodafone,16142,Private Sector,Nepal,Various Recipients,14744,Individual,Nepal,27/05/2015 00:00,0,Inkind,Disbursement,"In response to the earthquake, Vodafone has reduced the cost of calls made to and from Nepal. Calls between India and Nepal will only be charged at the local call rate.",Grant,US Chamber of Commerce Foundation,http://www.uschamberfoundation.org/corporate-citizenship-center/nepal-earthquake-corporate-aid-tracker,Shelter and Non-food Items,Not available,,,,,,,,,,,,,,,,,,,,,,,,,,,,,,,
23826,Western Union Foundation,16144,Foundation,Nepal,Various Recipients,14744,Individual,Nepal,27/05/2015 00:00,200000,Cash,Commitment,"The Western Union Company announced a multi-faceted response to provide support for families and communities affected by the earthquake in Nepal. The Foundation committed $200,000 in discretionary and matching grants. The Foundation will provide a 1:1 match of contributions from Western Union Agents and other business partners, and 1:2 match of employee donations.Additionally, all money transfers to Nepal will be free of any charges.",Grant,US Chamber of Commerce Foundation,http://www.uschamberfoundation.org/corporate-citizenship-center/nepal-earthquake-corporate-aid-tracker,Shelter and Non-food Items,Not available,,,,,,,,,,,,,,,,,,,,,,,,,,,,,,,
23827,Yahoo,16146,Private Sector,Nepal,Various Recipients,14744,Individual,Nepal,27/05/2015 00:00,623000,Cash,Commitment,"Yahoo enabled users globally to donate through their products, including Yahoo.com, News and Search, raising $500,000 for aid organizations, including UNICEF, Save the Children, International Medical Corps, Oxfam and various chapters of Red Cross. Employees contributed an additional $48,000 with Yahoo matching. The Yahoo Employee Foundation also provided a $75,000 emergency grant to the American Red Cross.",Grant,US Chamber of Commerce Foundation,http://www.uschamberfoundation.org/corporate-citizenship-center/nepal-earthquake-corporate-aid-tracker,Health,Not available,,,,,,,,,,,,,,,,,,,,,,,,,,,,,,,
23828,Alwaleed Bin Talal Foundations,16148,Foundation,South Africa,Various Recipients,14744,Individual,Nepal,27/05/2015 00:00,985222,Cash,Disbursement,"The donation by Alwaleed Foundation was made through international local agencies such as International Medical Corp, Habitat for humanity and the World Food Program.",Grant,Arab News,http://www.arabnews.com/economy/news/739171,Not available,Not available,,,,,,,,,,,,,,,,,,,,,,,,,,,,,,,
23829,Batas Foundation and Islamic Relief,16150,Foundation,Nepal,Various Recipients,14744,Individual,Nepal,27/05/2015 00:00,1674877,Inkind,Disbursement,,Grant,Nagariknews,http://nagariknews.com/society/story/38171.html,Not available,Not available,,,,,,,,,,,,,,,,,,,,,,,,,,,,,,,
23830,Nepali Congress earthquake relief fund,16157,Individual,Nepal,Various Recipients,14744,Individual,Nepal,27/05/2015 00:00,88728,Cash,Commitment,,Grant,SetoPati,http://setopati.com/raajneeti/28308/,Shelter and Non-food Items,Not available,,,,,,,,,,,,,,,,,,,,,,,,,,,,,,,
23831,Non-Resident Nepali Association (NRNA),16226,National NGO,Nepal,Various Recipients,14744,Individual,Nepal,27/05/2015 00:00,985222,Inkind,Commitment,,Grant,Online Khabar,http://www.onlinekhabar.com/2015/04/271336/,Shelter and Non-food Items,Sindhupalchok || Gorkha || Nuwakot || Dhading || Rasuwa || Kavre || Ramechhap,,,,,,,,,,,,,,,,,,,,,,,,,,,,,,,
23832,Non-Resident Nepali Association (NRNA),16226,National NGO,Nepal,Various Recipients,14744,Individual,Nepal,27/05/2015 00:00,3448276,Inkind,Commitment,,Grant,Online Khabar,http://www.onlinekhabar.com/2015/05/274269/,Shelter and Non-food Items,Not available,,,,,,,,,,,,,,,,,,,,,,,,,,,,,,,
23833,Non Resident Nepali Assoiation Africa,16161,Individual,South Africa,Various Recipients,14744,Individual,Nepal,27/05/2015 00:00,14778,Cash,Commitment,,Grant,Online Khabar,http://www.onlinekhabar.com/2015/04/271064/,Shelter and Non-food Items,Not available,,,,,,,,,,,,,,,,,,,,,,,,,,,,,,,
23834,"Political Parties, Chitwan",16166,Individual,Nepal,Various Recipients,14744,Individual,Nepal,27/05/2015 00:00,32512,Inkind,Commitment,,Grant,Online Khabar,http://www.onlinekhabar.com/2015/05/274446/,Shelter and Non-food Items,Not available,,,,,,,,,,,,,,,,,,,,,,,,,,,,,,,
23838,"Various Assocations and Individuals' donation via DAO, Kailali",16169,Individual,Nepal,Various Recipients,14744,Individual,Nepal,27/05/2015 00:00,20229,Cash,Disbursement,,Grant,Online Khabar,http://www.onlinekhabar.com/2015/05/275870/,Shelter and Non-food Items,Not available,,,,,,,,,,,,,,,,,,,,,,,,,,,,,,,
23839,Idea Cellular,16052,Private Sector,United States,Various Recipients,14744,Individual,Nepal,27/05/2015 00:00,0,Inkind,Disbursement,India telecom operator Idea Cellular has announced to its customers that all calls from India to Nepal will be charged at the local rate of Re 1 per minute instead of the usual Re 12 per minute.,Grant,US Chamber of Commerce Foundation,http://www.uschamberfoundation.org/corporate-citizenship-center/nepal-earthquake-corporate-aid-tracker,Emergency Telecommunications,Not available,,,,,,,,,,,,,,,,,,,,,,,,,,,,,,,
23840,Inditex,16000,Private Sector,United States,Various Recipients,14744,Individual,Nepal,27/05/2015 00:00,1340000,Cash,Commitment,"Inditex is donating 1.2 million euros, equivalent to about $1,340,000 USD, to the Red Cross, Oxfam, and Caritas to provide support to the devastated regions of Nepal.",Grant,US Chamber of Commerce Foundation,http://www.uschamberfoundation.org/corporate-citizenship-center/nepal-earthquake-corporate-aid-tracker,Not available,Not available,,,,,,,,,,,,,,,,,,,,,,,,,,,,,,,
23841,KAS Rugs,16010,Private Sector,United States,Various Recipients,14744,Individual,Nepal,27/05/2015 00:00,20000,Cash,Commitment,"KAS Rugs pledged $20,000 to assist in the aftermath of the April 25 earthquake in Nepal.",Grant,US Chamber of Commerce Foundation,http://www.uschamberfoundation.org/corporate-citizenship-center/nepal-earthquake-corporate-aid-tracker,Shelter and Non-food Items,Not available,,,,,,,,,,,,,,,,,,,,,,,,,,,,,,,
23842,Linde Group,16011,Private Sector,United States,Various Recipients,14744,Individual,Nepal,27/05/2015 00:00,34000,Cash,Commitment,"Technology company The Linde Group is supporting disaster relief in Nepal with EUR 30,000, equivalent to about $34,000 USD, in emergency aid. The donation will be given to the Red Cross and Save the Children.",Grant,US Chamber of Commerce Foundation,http://www.uschamberfoundation.org/corporate-citizenship-center/nepal-earthquake-corporate-aid-tracker,Shelter and Non-food Items,Not available,,,,,,,,,,,,,,,,,,,,,,,,,,,,,,,
23843,Oxigen,16092,Private Sector,United States,Various Recipients,14744,Individual,Nepal,27/05/2015 00:00,0,Inkind,Disbursement,"For the month following the earthquake, Oxigen, an online payment wallet company, is donating 1% of its daily transactions to the victims recovering in Nepal.",Grant,US Chamber of Commerce Foundation,http://www.uschamberfoundation.org/corporate-citizenship-center/nepal-earthquake-corporate-aid-tracker,Shelter and Non-food Items,Not available,,,,,,,,,,,,,,,,,,,,,,,,,,,,,,,
23844,JPMorgan Chase,16056,Private Sector,United States,Various Recipients,14744,Individual,Nepal,27/05/2015 00:00,450000,Cash,Commitment,"The JPMorgan Chase Foundation is making a total of $675,000 in grants to CARE, UNICEF, and the American Red Cross to support recovery efforts in Nepal. In addition, the Foundation will match employee donations up to $550,000 to reach over $1.78 million in donations by the company and its employees.",Grant,US Chamber of Commerce Foundation,http://www.uschamberfoundation.org/corporate-citizenship-center/nepal-earthquake-corporate-aid-tracker,Early Recovery,Not available,,,,,,,,,,,,,,,,,,,,,,,,,,,,,,,
23847,Paper Source,16095,Private Sector,United States,Various Recipients,14744,Individual,Nepal,27/05/2015 00:00,0,Inkind,Disbursement,"Paper Source will be donating 20% of proceeds from its Lokta paper, handcrafted in Nepal, to support earthquake recovery.",Grant,US Chamber of Commerce Foundation,http://www.uschamberfoundation.org/corporate-citizenship-center/nepal-earthquake-corporate-aid-tracker,Early Recovery,Not available,,,,,,,,,,,,,,,,,,,,,,,,,,,,,,,
23848,PayPal,16096,Private Sector,United States,Various Recipients,14744,Individual,Nepal,27/05/2015 00:00,0,Inkind,Disbursement,PayPal is waiving traditional transaction fees for donations made through their services to the earthquake relief. 100% of users' donations are going directly to the user's relief organization of choice.,Grant,US Chamber of Commerce Foundation,http://www.uschamberfoundation.org/corporate-citizenship-center/nepal-earthquake-corporate-aid-tracker,Shelter and Non-food Items,Not available,,,,,,,,,,,,,,,,,,,,,,,,,,,,,,,
23849,Pepsi Co India,16098,Private Sector,United States,Various Recipients,14744,Individual,Nepal,27/05/2015 00:00,0,Inkind,Disbursement,"Pepsico India announced that it is sending 60,000 one liter bottles to earthquake destroyed portions of Nepal.",Grant,US Chamber of Commerce Foundation,http://www.uschamberfoundation.org/corporate-citizenship-center/nepal-earthquake-corporate-aid-tracker,Shelter and Non-food Items,Not available,,,,,,,,,,,,,,,,,,,,,,,,,,,,,,,
23851,Pimco Foundation,16100,Foundation,United States,Various Recipients,14744,Individual,Nepal,27/05/2015 00:00,0,Inkind,Disbursement,Both the PIMCO US and Europe Foundations are making disaster assistance donations to Save the Children and CARE. The PIMCO Foundation will also match employees' donations.,Grant,US Chamber of Commerce Foundation,http://www.uschamberfoundation.org/corporate-citizenship-center/nepal-earthquake-corporate-aid-tracker,Shelter and Non-food Items,Not available,,,,,,,,,,,,,,,,,,,,,,,,,,,,,,,
23852,Rasna,16105,Private Sector,United States,Various Recipients,14744,Individual,Nepal,27/05/2015 00:00,0,Inkind,Disbursement,"To aid in recovery efforts, beverage maker Rasna of India is sending seven tons of glucose powder and milkshake mix to the survivors in Nepal.",Grant,US Chamber of Commerce Foundation,http://www.uschamberfoundation.org/corporate-citizenship-center/nepal-earthquake-corporate-aid-tracker,Shelter and Non-food Items,Not available,,,,,,,,,,,,,,,,,,,,,,,,,,,,,,,
23853,Sutter Health,16121,Private Sector,Nepal,Various Recipients,14744,Individual,Nepal,27/05/2015 00:00,500000,Cash,Commitment,"Sutter Health announced its commitment to aiding Nepal with a $250,000 donation to both the American Red Cross and International Medical Corps, for a total of $500,000.",Grant,US Chamber of Commerce Foundation,http://www.uschamberfoundation.org/corporate-citizenship-center/nepal-earthquake-corporate-aid-tracker,Health,Not available,,,,,,,,,,,,,,,,,,,,,,,,,,,,,,,
23856,Tata Teleservices,16126,Private Sector,Nepal,Various Recipients,14744,Individual,Nepal,27/05/2015 00:00,0,Inkind,Disbursement,"Tata Teleservices announced that calls placed between India and Nepal would be charged at a local rate, instead of the usual international rate, to help families and friends contact loved ones in the devastated regions of Nepal.",Grant,US Chamber of Commerce Foundation,http://www.uschamberfoundation.org/corporate-citizenship-center/nepal-earthquake-corporate-aid-tracker,Shelter and Non-food Items,Not available,,,,,,,,,,,,,,,,,,,,,,,,,,,,,,,
23858,The Clorox Company,16128,Private Sector,United States,Various Recipients,14744,Individual,Nepal,27/05/2015 00:00,2500,Cash,Commitment,"The Clorox Company is matching donations made to relief organizations dollar for dollar up to $2,500 through its workplace giving program.",Grant,US Chamber of Commerce Foundation,http://www.uschamberfoundation.org/corporate-citizenship-center/nepal-earthquake-corporate-aid-tracker,Shelter and Non-food Items,Not available,,,,,,,,,,,,,,,,,,,,,,,,,,,,,,,
23864,Research and Markets,16106,Private Sector,United States,Various Recipients,14744,Individual,Nepal,27/05/2015 00:00,55000,Cash,Commitment,"Research and Markets announced a 50,000 euro, equivalent to about $55,000 USD, donation to relief efforts in Nepal through UNICEF and Médecins Sans Frontières.",Grant,US Chamber of Commerce Foundation,http://www.uschamberfoundation.org/corporate-citizenship-center/nepal-earthquake-corporate-aid-tracker,Shelter and Non-food Items,Not available,,,,,,,,,,,,,,,,,,,,,,,,,,,,,,,
23865,Walmart,16143,Private Sector,Nepal,Various Recipients,14744,Individual,Nepal,27/05/2015 00:00,250000,Cash,Commitment,"The Walmart Foundation is donating $250,000 to support relief efforts in Nepal – $100,000 to International Medical Corps and $150,000 for the American Red Cross. These funds will provide immediate medical needs, food and shelter for those affected. The company is also working to provide an opportunity for Walmart customers and associates to donate directly to the Red Cross.",Grant,US Chamber of Commerce Foundation,http://www.uschamberfoundation.org/corporate-citizenship-center/nepal-earthquake-corporate-aid-tracker,Health,Not available,,,,,,,,,,,,,,,,,,,,,,,,,,,,,,,
23866,JCB,16001,Private Sector,United States,Nepalease Army,16227,Government,Nepal,27/05/2015 00:00,1000000,Inkind,Disbursement,"JCB has supplied the Nepalese Army with ten backhoe loaders to support recovery efforts in Nepal. The machinery is worth an estimated £650,000, equivalent to nearly $100,000 USD, and it will help in reconstruction efforts in the coming months.",Grant,US Chamber of Commerce Foundation,http://www.uschamberfoundation.org/corporate-citizenship-center/nepal-earthquake-corporate-aid-tracker,Early Recovery,Not available,,,,,,,,,,,,,,,,,,,,,,,,,,,,,,,
23867,Paytm,16097,Private Sector,United States,Various Recipients,14744,Individual,Nepal,27/05/2015 00:00,0,Inkind,Disbursement,India's fast growing pay-through-mobile shopping site is matching donations made through their website to go directly to a fund set up by the government of India’s Nepal specific region. Coupons can be selected at checkout with values ranging from Rs 10 to Rs 10000.,Grant,US Chamber of Commerce Foundation,http://www.uschamberfoundation.org/corporate-citizenship-center/nepal-earthquake-corporate-aid-tracker,Shelter and Non-food Items,Not available,,,,,,,,,,,,,,,,,,,,,,,,,,,,,,,
23868,Procter and Gamble,16103,Private Sector,United States,Various Recipients,14744,Individual,Nepal,27/05/2015 00:00,500000,Cash,Commitment,"To aid the critical need for food, shelter and other necessities, P&G has provided $500,000 to support  long-standing global emergency relief partner organizations currently working on the ground in Nepal including AmeriCares, CARE, International Medical Corps, Save the Children and World Vision. P&G is also working with partners to supply P&G Purifier of Water packets. The initial response will include enough packets to provide 2 million liters of clean drinking water.",Grant,US Chamber of Commerce Foundation,http://www.uschamberfoundation.org/corporate-citizenship-center/nepal-earthquake-corporate-aid-tracker,Health,Not available,,,,,,,,,,,,,,,,,,,,,,,,,,,,,,,
23869,The Walt Disney Company,16129,Private Sector,Nepal,Various Recipients,14744,Individual,Nepal,27/05/2015 00:00,1000000,Cash,Commitment,"The Walt Disney Company has committed $1 million to support recovery and rebuilding efforts for victims of the earthquake in Nepal through Save the Children and American Red Cross. In addition, The Walt Disney Company Foundation will match eligible U.S. cast member and employee donations— from $25 up to $15,000 per year—to Save the Children, American Red Cross and other humanitarian organizations approved to participate in the Disney Employee Matching Gifts Program.",Grant,US Chamber of Commerce Foundation,http://www.uschamberfoundation.org/corporate-citizenship-center/nepal-earthquake-corporate-aid-tracker,Shelter and Non-food Items,Not available,,,,,,,,,,,,,,,,,,,,,,,,,,,,,,,
23870,Surya Nepal Private Ltd,16228,Private Sector,Nepal,Various Recipients,14744,Individual,Nepal,27/05/2015 00:00,0,Inkind,Disbursement,"A subsidiary of ITC Limited, Surya Nepal has sent 200,000 food packets in addition to supplies of biscuits and instant noodles to Nepal.",Grant,US Chamber of Commerce Foundation,http://www.uschamberfoundation.org/corporate-citizenship-center/nepal-earthquake-corporate-aid-tracker,Shelter and Non-food Items,Not available,,,,,,,,,,,,,,,,,,,,,,,,,,,,,,,
23871,GlaxoSmithKline (GSK),16044,Private Sector,United Kingdom,Save the Children,14787,International NGO,Not applicable,27/05/2015 00:00,76000,Cash,Disbursement,"Following the earthquake in Nepal, GSK is working with our humanitarian aid partners providing urgently needed funds and medical supplies to support their response in the affected area. GSK has donated £50,000, or about $76,000 USD, each to Save the Children and CARE International, providing for the immediate needs of shelter, water, food, hygiene and sanitation.  Both CARE International and Save the Children have a long-established presence in Nepal and are providing an immediate response.",Grant,US Chamber of Commerce Foundation,http://www.uschamberfoundation.org/corporate-citizenship-center/nepal-earthquake-corporate-aid-tracker,Not available,Not available,,,,,,,,,,,,,,,,,,,,,,,,,,,,,,,
23872,GlaxoSmithKline (GSK),16044,Private Sector,United Kingdom,Plan International,16055,International NGO,Not available,27/05/2015 00:00,76000,Cash,Disbursement,"Following the earthquake in Nepal, GSK is working with our humanitarian aid partners providing urgently needed funds and medical supplies to support their response in the affected area. GSK has donated £50,000, or about $76,000 USD, each to Save the Children and CARE International, providing for the immediate needs of shelter, water, food, hygiene and sanitation.  Both CARE International and Save the Children have a long-established presence in Nepal and are providing an immediate response.",Grant,US Chamber of Commerce Foundation,http://www.uschamberfoundation.org/corporate-citizenship-center/nepal-earthquake-corporate-aid-tracker,Not available,Not available,,,,,,,,,,,,,,,,,,,,,,,,,,,,,,,
23873,GlaxoSmithKline (GSK),16044,Private Sector,United Kingdom,Various Recipients,14744,Individual,Nepal,27/05/2015 00:00,0,Inkind,Disbursement,"We are also working with our medicine donation partners – AmeriCares, Direct Relief and Project HOPE – who are experienced in the delivery of humanitarian aid, to assess medical needs and respond. A first small consignment of antibiotics and anti-infective creams from GSK has already been delivered by a team from AmeriCares, to be followed by further shipments in the coming days and weeks.",Grant,US Chamber of Commerce Foundation,http://www.uschamberfoundation.org/corporate-citizenship-center/nepal-earthquake-corporate-aid-tracker,Health,Not available,,,,,,,,,,,,,,,,,,,,,,,,,,,,,,,
23874,European Commission,14799,Multilateral,Not applicable,Agency for Technical Cooperation and Development (ACTED),14801,National NGO,France,25/01/2016 00:00,875274,Cash,Disbursement,Natural disasters / Providing crucial winterization to earthquake-affected populations in Nepal - Emergency and transitional shelter assistance to earthquake-affected populations (ECHO/-SA/BUD/2015/91046),Grant,UN OCHA Financial Tracking Service,https://fts.unocha.org/pageloader.aspx?page=emerg-emergencyCountryDetails&cc=npl,Shelter and Non-food Items,Not available,UN OCHA FTS,242359,50,Emergency and transitional shelter assistance to earthquake-affected populations,,,,0000-00-00,,,,3801494,14776 || 14799 || 14923,Canada (Government of) || European Commission || United States of America (Government of),14801 || 14781,Agency for Technical Cooperation and Development (ACTED) || Center for International Studies and Coorporation (CECI),,,,,,,,Shelter and Non-food Items,Not available,,,UN OCHA FTS,NPL-15/S-NF/80419/R,UN OCHA Financial Tracking Service, https://fts.unocha.org/pageloader.aspx?page=emerg-emergencyCountryDetails&cc=npl
23875,Luxembourg (Government of),14843,Government,Luxembourg,ONGD - FNEL,16230,National NGO,Luxembourg,04/02/2016 00:00,66373,Cash,Commitment,Reconstruction of houses (AH/FNEL/2016/0001  1/2),Grant,UN OCHA Financial Tracking Service,https://fts.unocha.org/pageloader.aspx?page=emerg-emergencyCountryDetails&cc=npl,Shelter and Non-food Items,Not available,UN OCHA FTS,242701,,,,,,,,,,,,,,,,,,,,,,,,,,,,,
